row_id,Title,Review,Polarity,Town,Region,Type,sentimiento_5,sentiment
90490,"Buen bistec, carne, hamburguesas, costillas de cerdo, la comida es maravillosa!","Este es un gran lugar para comer, el almuerzo o la cena. . . Simplemente genial. La comida es generalmente una maravilla.
El servicio puede ser lento. Un día con muy pocas personas a almorzar, fue cuarenta y cinco minutos antes nos sirvieron.
En su...misma queja como propietario de otro restaurante, en el bar se encuentra mirando a su tablet, y nunca los intentos de conversar con sus clientes. Un amigo iba y dijo que el último día decidimos venir aquí. . . No gracias, no hay reconocimiento de que en la zona de ajijic hay muchos lugares para cenar y no reconocimiento de elegir Adelitas. Sabemos que el restaurante hace bien, pero aprecio al cliente, caminar y ser amable hace mucho wat en la comida y la bebida de negocios.Más",4.0,Ajijic,Jalisco,Restaurant,-0.2098328024148941,-0.105331
176992,Lindo lugar,"Me gustó porque es un lugar lindo, agradable y divertido, los niños también se divierten muchísimo. Lo recomiendo ampliamente.",5.0,Teotihuacan,Estado_de_Mexico,Attractive,0.9814825505018234,0.770894
57192,Tarde riquísima en Jaguara!!,"Un lugar súper lindo, con comida exquisita y atención impecable!! 
Los cocktails también muy ricos! 
Muy recomendable!!",5.0,Bacalar,QuintanaRoo,Restaurant,0.9808820434845984,0.808345
188816,Quiero intentar de nuevo,"Comimos allí una noche, y esto puede haber sido la razón de mi sopa de alubias estaba frío. No me importaba porque era tan bueno. Mi marido tenía camarones a la parrilla y estaban frescos y deliciosos. Estaban fuera de la cerveza, así que no...tuvimos oportunidad de probar las tazas de frío. Volveremos.Más",3.0,Isla_Mujeres,QuintanaRoo,Restaurant,0.932556367944926,0.153813
168740,Diversión para los kiddos Día y adultos.,"Visitamos la isla a visitar a un amigo. Queríamos un ambiente que era un adulto y para los niños! Bien, aquí es tu lugar! Los niños disfrutaron de la piscina cerrada arbolada, varios toboganes y playa, buceo y mucho más! Los adultos disfrutamos el bar junto a la piscina! ! ! ! ! ! La comida y el servicio era genial! Sin duda volveremos!",5.0,Isla_Mujeres,QuintanaRoo,Attractive,0.9571611292194576,0.815665
161590,Estilo barroco,me gustó su arquitectura y estilo barroco. Su interior de gran imponencia. La nave y los retablos se destacan por su arquitectura.,5.0,Taxco,Guerrero,Attractive,0.9739753028843552,1.0
111673,Vistas espectaculares,"Recorrida en los incontables carritos, que son usados por los turistas de todas las nacionalidades; hospedado en Playa Norte (lo mejor en playa) recorrer la isla en ambos extremos, nos muestra belleza y un mar con un oleaje bravo. Recorrer la Isla de extremo a extremo, es un placer.",4.0,Isla_Mujeres,QuintanaRoo,Attractive,0.959250158863142,-0.152911
139273,La gruta azul de mexico!,"Guau. . . simplemente guau. Mi familia visitó Cenote Palomitas como parte de un tour privado que comenzó con Ek Balam. A pesar de lo impresionantes que fueron los templos, la belleza de este cenote nos impresionó por completo. El agua es de un azul impresionante, y cuando la luz es la adecuada (llegamos alrededor del mediodía), toda la cueva brilla como la Gruta Azul en Capri. Está un poco alejado de todo, pero definitivamente vale la pena visitarlo si puedes. Incluso a mis hijos, que tenían un poco de temor por nadar en una cueva, les encantó. Un agradecimiento especial a Soy La Pesera por recomendar este lugar y organizar un día tan maravilloso!",5.0,Valladolid,Yucatan,Attractive,0.9272809633985162,0.832406
102196,Pintoresco ,"Una iglesia pintoresca con una plaza de mucho movimiento, la primera impresión fue de noche un sábado y habían muchas ventas en la plaza, el domingo en el día ya no estaban, pero la iglesia permanece cerrada. No entiendo por que siendo un lugar muy turístico. ",4.0,San_Cristobal_de_las_Casas,Chiapas,Attractive,-0.4289989322423935,-0.216397
160220,Delicioso desayuno! ,El lugar tiene un concepto y un diseño increíble! La tienda y la galería de arte tienen cosas muy interesantes. La terraza para desayunar es cómoda y muy bonita además que el desayuno estuvo riquísimo y a buen precio. Dani nos atendió con mucha amabilidad...Más,5.0,Bacalar,QuintanaRoo,Restaurant,0.980116292834282,0.957063
164914,Posada del tepozteco,La posada del tepozteco tiene una hermosa vista en donde se ve todo tepoztlan y  el cerro del tepozteco es un lugar muy tranquilo para comer en el restaurante llamado sibarita la cecina es buenísima y el hotel tiene un encanto mágico.,5.0,Tepoztlan,Morelos,Attractive,0.9705208651721478,1.0
150803,Maravillosa ubicación,"Hermosa propiedad. Un pequeño hotel boutique con forma de medialuna casi en una playa privada. La propiedad tiene terrazas así que siempre te sientes que está recibiendo una gran vista.
Bueno era muy buena, el servicio era un poco desinteresado y éxito. Los cócteles eran...muy buenoMás",4.0,Tulum,QuintanaRoo,Restaurant,0.9713514987379313,0.869541
28713,¡Excelente!,"Estamos aquí ahora por una semana, los jardines están muy bien cuidados, el desayuno completo es delicioso, está bellamente decorado y está muy, muy limpio y desinfectado, y la ubicación está a poca distancia de tiendas y restaurantes maravillosos. Todo el trato personal como si estuvieras en su casa. Volvería en un abrir y cerrar de ojos.",5.0,Tlaquepaque,Jalisco,Hotel,0.9689229906070976,0.70194
20212,EL MEJOR,"Comí ahí por sugerencia de Juan Carlos dueño del hotel Luciernagas, y fue delicioso, la comida es simplemente exquisita, además de este lugar comí en otros como Dipao, La michoacana y Soleado y no hay punto de comparación, por mucho es el mejor, felicidades.",5.0,Valle_de_Bravo,Estado_de_Mexico,Restaurant,0.9745407954324036,0.678803
49417,Excelente combinación de sabores,"Un restaurante muy agradable, la atención del personal excelente. Las bebidas muy ricas con unos sabores muy marcados. La presentación de los platillos es muy exótica y el sabor de los mismos deliciosos. Recomiendo el postre Baked Alaska! es una maravilla!!!!Más",5.0,Tulum,QuintanaRoo,Restaurant,0.9782068456988782,0.83164
66861,Exquisito!,"Prueben la pizza de varios quesos, es deliciosa! No dejen de probar las cervezas artesanales. Excelente atención y lugar!",5.0,Tequisquiapan,Queretaro,Restaurant,0.9575694107916206,0.902364
99673,No te lo puedes perder!,Increíble. Maravilloso. exorbitante. Esta casa (casa) es algo fuera de este mundo!Lleno con la más impresionante arte folklórico mexicano en una preciosa casa en la pequeña ciudad más mona de Valladolid- que le recomendaría a todo el mundo a través de la parada aquí.Disfrutamos de nuestra parada de una noche en Valladolid más de los 3 días que tuvimos en Mèrida! Una joya escondida esta ciudad y esta casa.,5.0,Valladolid,Yucatan,Attractive,0.9633833761326968,0.95516
94597,"nuestra primera visita, pero desde luego no el último.","Se trata de un hotel boutique que se presta para parejas. Uno de los lugares más bonitos en los que he estado en una gran ubicación para parejas que prefiere evitar grandes hoteles de lujo. Lo único mejor que el hotel era el personal. eran profesionales y lo más importante es que verdaderamente disfrutamos trabajando allí, cuidando de cada necesidad. La comida en ser Tulum fue fantástico y el bar y los camareros eran muy buenos. No te pierdas el almuerzo de barbacoa proporcionan un par de veces a la semana. Están trabajando en un spa, pero a la vez que ofrecen servicios de habitación. El masaje en pareja no podría haber sido mejor. Sin duda tenemos ganas de volver. Esto no es un hotel barato pero cuando se considera la calidad, vale la pena pagar precio.",5.0,Tulum,QuintanaRoo,Hotel,0.968037688639015,0.978085
19221,Gran desayuno,Por 50 pesos te dan un gran desayuno en un restaurante familiar. El personal es agradable y los precios son los mejores! Otro debe encontrar.,4.0,Isla_Mujeres,QuintanaRoo,Restaurant,0.9621223038993776,0.711667
186241,"Una estancia agradable, pero puede mejorar... especialmente por este precio","Realmente disfrutamos de nuestra estancia en la playa. Reservamos una habitación en la azotea con jacuzzi y nos alojamos 4 noches 2 días, otro habría sido mejor. Durante nuestra estancia, la playa era bastante viento, sin embargo, había un montón de cosas que ocupan nuestro tiempo cuando no pudimos disfrutar de la playa.  Las habitaciones están muy bien decoradas y equipadas, y no eché de menos la televisión. Habría estado bien tener algo para tocar música. Utilizamos la azotea para disfrutar de los amaneceres y relajarse en un espacio privado. El balcón con hamaca es sin embargo más bonito no es completamente privada como se puede ver el balcón de al lado. Creo que esto podría haber estado mejor implementado. Yo diría que la comida era buena, pero no excelente.  La ubicación de",4.0,Tulum,QuintanaRoo,Hotel,0.8353043887764215,0.633872
16507,Hotel Montetaxco un hotel de altura.,"Taxco es una ciudad encantadora nacida de la determinación del hombre por arrancar riquezas de las entrañas de la tierra, pueblo minero, donde la tasita de plata (en este caso de oro) es la Iglesia de Santa Prisca muestra del Barroco Novohispano, como lo llamo Octavio Paz. Y el hotel Montetaxco  se encuentra en lo alto desde donde se tiene una vista panorámica de esta bella ciudad, si quieres descansar del bullicio, en un ambiente relajado, con la vista increíble de un pueblito colonial, Montetaxco es el lugar ideal.",5.0,Taxco,Guerrero,Hotel,0.9283970766700804,0.839041
127694,Fresco tulum,Todo fue un exito. Omar nos atendió. Muy amable y el servicio excelente. Definitivamente volveremos.,5.0,Tulum,QuintanaRoo,Restaurant,0.9779204204678535,0.69268
103156,Riquísima Pizza!!!!,"Pizza muy buena, se acerca mucho de las pizzas de Brasil. Tiene mucha opción, ambiente agradable, bueno servicio! Pero falta periquera para los niños!!",5.0,Metepec,Estado_de_Mexico,Restaurant,0.9721459753345698,0.76732
150152,Rosa Negra Tulum,"excelente lugar, atencion de primera, ademas de los platillos exquisitos la comida es muy basta! 
la atencion del gerente fue perfecta, siempre al pendiente! 
MUY recomendable!!",5.0,Tulum,QuintanaRoo,Restaurant,0.9790269918739796,0.968731
58092,Hermosa puesta de sol!,El sendero es totalmente la pena! ! Gran lugar donde presencia un hermoso atardecer! !Asegúrese de llevar repelente de insectos y una linterna para la vuelta,5.0,Mazunte,Oaxaca,Attractive,0.965935357613489,0.942134
14273,playas tranquilas,"me toco plenas vacaciones,habia demasiada gente y el transito vehicular no esta bien organizado,asi que es un caos,pero una vez a pie se disfruta este lugar y se explora cada playa o comercio con cantidad de artesanias",5.0,Sayulita,Nayarit,Attractive,-0.7606117334216833,-0.671519
127981,De lo mejor de Tepotzotlan ,"Los ingredientes de los platillos son naturales. Excelente sabor de los alimentos. Lo mejor del lugar el te chai, chapata argentina, las tapas de espárragos y no puedes irte del lugar sin degustar un cheesecake de Jamaica. Es un lugar tranquilo al sonido de Blues...Más",5.0,Tepotzotlan,Estado_de_Mexico,Restaurant,0.9664500446524472,0.890816
189770,"Precioso, pero caro","Nos alojamos por 4 noches a principios de febrero. Hotel tiene una preciosa ubicación, justo en la playa, con todas las habitaciones con vistas al Caribe. Puertas, frente a la playa, tienen grandes paneles de cristal, que es maravillosa. 4 camas con dosel con mosquitero que está ingeniosamente sacó con soltura y pueden ser liberados durante la temporada de los mosquitos. Albornoces de felpa, así como gran urna cerámica con agua potable. Muy buena ducha. Agua limpios ""contenedores"" en frente de las puertas entrada con paneles de vidrio y limpiarse arena antes de entrar en habitación. Termo con café y cruasanes o algo similar ofrecido cada mañana. El servicio era excelente. Tienen un restaurante en donde tuvimos un excelente desayuno la primera mañana. No tienen otras comidas allí",4.0,Tulum,QuintanaRoo,Hotel,0.6259589195251465,0.526728
55962,OK,"Titubeo, debo marcar como promedio o muy bueno? Hemos comido aquí varias veces en el pasado y disfrutamos de la soupa de lima y la sopa de alubias (y varios otros elementos). Esta vez cada uno pidió un sopa. Soupa de lima de mi marido...estaba tan delicioso como el recuerdo de otros viajes, pero mi sopa de alubias no era ni de lejos tan buena. La sopa caliente no era incluso cuando llegó a la mesa, así que envié a conseguir climatizada después de darle una oportunidad. Era como una lata de judías había sido abierto y tenía algunas cebollas crudas. No hace falta decir que no volveremos.Más",4.0,Isla_Mujeres,QuintanaRoo,Restaurant,0.197444288060069,0.542831
163116,Ir tras horas,Ofrecen horas de 5 - 7 por $225 pesos y lo que vale la pena cada céntimo. Teníamos literalmente el lugar para nosotros. Hermoso lugar con increíbles vistas al mar.,5.0,Tulum,QuintanaRoo,Attractive,0.9698062462266536,0.918524
157311,Robo absoluto de un trato!,"Este hotel fue fantástico! Reservamos a través de hoteles. com por $ 142 por noche, pero después de contactar directamente con el hotel, ¡nos volvieron a reservar por solo $ 102 por noche! Garantizan la mejor tarifa si reserva a través de ellos, así que vaya directamente a ellos. ¡Por ese precio, este hotel vale la pena!  Ventajas: Nuestra habitación tenía una vista increíble del océano, justo en una hermosa playa privada (solo compartida con el hotel boutique de al lado), el personal era extremadamente amable, el desayuno gratis era todo el menú de desayuno (no el típico desayuno continental en la mayoría de los hoteles) y deliciosas, las bebidas 2 por 1 en la hora feliz fueron geniales, y el aire acondicionado funcionó sin problemas. La ubicación también es buena, a poca",5.0,Tulum,QuintanaRoo,Hotel,0.940499840537086,0.754943
238,Hermoso,"Al entrar, hay personas que te hacen pensar que son de ahí y te venden las entradas, pero en realidad lo que venden son tours para visitar las ruinas en una lancha por un precio muy elevado, mucho cuidado con estas personas, pueden comprar el boleto de acceso a las ruinas por un precio muy económico, como el costo de cualquier museo. Las ruinas son pequeñas, hace muchísimo calor y la mejor forma de refrescarse es terminar el recorrido en el mar, sin duda la mejor playa, como una alberca, totalmente tranquila y cristalina ",5.0,Tulum,QuintanaRoo,Attractive,0.6636074930429459,0.60949
116438,Camas duriiisimas,"Hola,  la zona esta bien ubicada,  sin embargo el hotel es viejo y las camas están del nabo,  amanecí con un dolor increíble de cuello y espalda,  la comida si muy rica,  pidan lomitos entomados,  de lujo!!",1.0,Valladolid,Yucatan,Hotel,0.9516008282080292,0.733732
88740,Disfrutamos mucho de la estancia,"Una gran relación calidad-precio. No es tan elegante como algunos de sus vecinos pero también no sólo su muy básico, sin florituras cabaña de playa. Tiene todo lo que necesita: una gran ducha, A/C, grande y bien camas y una hamaca en el porche. todo limpio espumoso. y la playa es el mismo para cada hotel allí ( realmente tienen una muy buena sección). Es un hotel de precio medio que no hay muchos en la playa de Tulum.",5.0,Tulum,QuintanaRoo,Hotel,0.9204748715274036,1.0
55266,Hotel 100% recomendable,"Tuve la oportunidad de viajar aquí con mi familia, y fue de las mejores experiencias. La vista sin duda desde las habitaciones es realmente impresionante, sobre todo en el amanecer y el atardecer. La comida es muy buena, y el buffet es muy variado. En la alberca la atención es buena y tienen un show en la noche muy divertido, ya que hay bailes regionales, fuegos artificiales y música de banda de viento (todo esto incluido en el paquete) El show en la disco para niños fue bueno ya que bailaron y se divirtieron como locos. Pedimos una habitación con dos camas matrimoniales y nos comentaron que está recien remodelada. El personal en recepción es muy atento ya que nos cambiaron de habitación 2 veces hasta encontrar la que mejor nos parecía sin problema alguno (obvio por que no había",5.0,Taxco,Guerrero,Hotel,0.9761201282963156,0.702454
203245,super recomendable,"muy buena atención!, ubicación muy buena, esta a 1 cuadra de la terminal de buses, nos dejaron entrar antes de la hora de chek-in, la habitación tenia olor a humedad pedimos cambio y nos cambiaron de in mediato, la piscina muy buena, la verdad ningún queja en lo mas mínimo!",5.0,Palenque,Chiapas,Hotel,0.8926573600620031,-0.732021
123379,Tiempo para relajarse.,Yo catalogado como 4 porque la cama era muy dura. El servicio era excelente. Dispone de una gran piscina con un tobogán limpio para los niños. También tiene un bar de piscina. Disfrutamos de nuestra estancia. También nos ofrecieron y late check-out en cada tarde la fruta ofrecida en nuestras habitaciones. Volveremos seguro.,4.0,Ixtapan_de_la_Sal,Estado_de_Mexico,Hotel,0.9203196284361184,0.976829
193901,Muy divertido,Fui allí en octubre desde San Cristóbal. Hubiera sido más divertido si no estaba demasiado fría para entrar al agua. Era precioso!,4.0,Palenque,Chiapas,Attractive,0.9489227328449488,0.909928
69198,Tulum estaba precioso!,"La excursión comienza con una zona comercial. Mucha presión a entrar en ""su espacio"" Una vez que estábamos pasando esta zona cogimos un tren a la entrada. Teníamos un guía que es una buena idea. El fondo y la historia y no son simplemente pasear. La línea de la costa es precioso. Recomiendo buenos zapatos, agua un sombrero o paraguas. Hacía mucho calor este día. Se le ofrece la posibilidad de nadar junto a la costa si lo deseas. Nuestro viaje fue una excursión de dos horas. Si tienes pensado ir de compras no es suficiente tiempo. Hicimos un viaje organizado 2 horas en Tulum y Xel Ha en 5 horas. Esto era bueno y malo. Lo bueno es que sólo pagamos $20,00 USD para Tulum. Precio razonable individualmente, habría sido $69.00 USD. Lo malo es que no fue suficiente tiempo. Recomiendo este viaje, aunque no es para niños pequeños, adultos mayores o discapacitados hay que caminar mucho.",4.0,Tulum,QuintanaRoo,Attractive,0.8831791849806905,0.881511
195486,Hay mejores lugares,"Los costos son sumamente elevados , las habitaciones no son de lo mejor , no respetan las reservaciones qué haces por las páginas de internet , en definitiva hay mejores hoteles a lo mejor del mismo costonpero con una atención y relación costo producto mil veces mejor , busquen opciones ya que está mil veces mejor el hotel loto azul ",3.0,Valle_de_Bravo,Estado_de_Mexico,Hotel,-0.7670036517083645,-0.78739
127632,GENIAL UNA BUENA OPCION,"Fuiu con unos amigos y el trato de los responsables del centro fue excelente,sobretodo por Pep que es español como nosotros.Lo tienen todo muy limpio y bien montado con unos cuartos de baño ecologicos y unas cabañitas para cambiarte ropa muy bien puestas.El paisaje y la diversión estan aseguradas.Les aplaudo por hacerlo todo tan espectacular y cuidarlo tanto.",5.0,Tulum,QuintanaRoo,Attractive,0.9737882618792356,0.076377
176405,El mejor servicio y la mejor vista!,"Escogí este hotel por la arquitectura, al llegar me di cuenta que ningún otro hotel en Ajijic tiene vista a la laguna y al pueblo desde todas sus habitaciones.  Pudimos ir caminando a mi restaurante favorito de Ajijic y además tiene estacionamiento cerrado. Nos atendieron súper bien, nos hizo falta algo y nos lo fueron a comprar. La cama súper cómoda, descansamos muy agusto! El desayuno incluído muy completo y rico!  Súper recomendado!",5.0,Ajijic,Jalisco,Hotel,0.9659663226921112,0.783116
87039,Los propietarios y el personal encantador.,Almuerzos servidos por gente encantadora. Comimos varias veces aquí. No fatal con un almuerzo un día como nuestra ensalada llegó sin queso y cuando señaló no vuelvas con algunos. Aún así le doy 5 como la comida es deliciosa y los precios justos.,5.0,Isla_Mujeres,QuintanaRoo,Restaurant,0.8457602518610656,0.713353
200333,***Pesimo***,"Lo único que puedo decir es que fue una ASQUEROSA experiencia, NO HAY  nada de HIGIENE en las instalaciones, te prometen una estancia agradable y solo fue una pérdida de tiempo y dinero, NO LO RECOMIENDO. He estado en lugares más económicos pero con mucha limpieza y aquí definitivamente las habitaciones distan mucho de estar limpias. Les detallo la suciedad de las habitaciones, las camas repletas de vellos, con manchas muy asquerosas, y al momento de pedir que hicieran la limpieza del cuarto, el personal con una actitud nada agradable, ""terminaron su trabajo"" sin quitar manchas en el suelo y la estancia del baño igual de asqueroso que el resto de la habitación. Definitivamente mi peor experiencia en ese lugar que al parecer no saben lo que es la limpieza.",1.0,Huasca_de_Ocampo,Hidalgo,Hotel,-0.981118356110528,0.117651
147612,Riquísimo,"La atención es buenísima, desde que llegas hasta que te vas, la comida deliciosa, el lugar es lindísimo. Lo recomiendo mucho.",5.0,Valle_de_Bravo,Estado_de_Mexico,Restaurant,0.9746001698076724,0.068906
171339,Muy bonito pero muuuy largo el recorrido,"Es un lugar muy bonito para pasar el día, sin embargo tienes que ir con muchas ganas y con la ropa más cómoda, ya que son varios kilómetros por recorrer y por ende varias horas. El recorrido es por la orilla del río y se puede practicar tirolesa y es un lugar super agradable para niños y adultos.",4.0,Orizaba,Veracruz,Attractive,0.9617046096827836,0.821706
30594,"Limpio, relajante y cómoda.","  Me ENCANTARON los hacienda de Todos los Santos!!! Estaba tan limpia y cómoda, lo que es difícil de encontrar en mi opinión! Está a una corta distancia de todo, y la gente es tan amable! La señora habla inglés nativo, así que no tuvimos problemas de comunicación. Las Casitas (hay tres, y 4 suites en progreso) son tan tranquilo y relajante. Es tranquilo y hay una piscina y una fuente preciosa. Me alojaré aquí de nuevo!    ",5.0,TodosSantos,Baja_CaliforniaSur,Hotel,0.9754936918616296,0.741419
128249,Buenisimo,"La verdad es un pequeño restaurante pero con toda la calidad de uno grande. Atendido por sus dueños. El servicio, la comida, postres, vino. Todo increible. Uno de esos tesoros culinarios en Mazunte!!!",5.0,Mazunte,Oaxaca,Restaurant,0.9764067204669118,0.686646
68271,El mejor cumpleaños!,"Me hospede dos noches en Coco Tulum para celebrar mi cumpleaños, fue una experiencia increíble! El personal de recepción siempre fue amable y atento,preguntándome que tal iba mi día o haciendo recomendaciones para conocer otros lugares. El desayuno incluido en Juanita Diavola fue variado y super rico.  No dejen de probar la cocteleria del club de playa!  Regresaré tan pronto como pueda. Gracias por sus atenciones a todo el equipo de Coco Tulum.",5.0,Tulum,QuintanaRoo,Hotel,0.9643030848819762,0.996758
188270,Gran opción para tomar café ,"El lugar es muy agradable. El personal muy amable pero es increíblemente lento, tardaron alrededor de 20 minutos en servir 2 tazas de café. 

La variedad de preparación es amplia y se pueden disfrutar de una tarta de trufa deliciosa.",4.0,Huasca_de_Ocampo,Hidalgo,Restaurant,0.9643579500261694,0.865325
141680,Imponente,"Grandiosa pirámide, que constituye el punto más alto del conjunto arqueológico. El encanto puede verse limitado por la multitud que asciende y desciende contínuamente, tal que las colas son importantes. Recomendable escoger un buen momento, preferiblemente temprano, para poder percibir el encanto mágico del lugar con más intimidad.",5.0,Teotihuacan,Estado_de_Mexico,Attractive,0.8595734154805541,0.7967
121504,un contacto personal y cercano con aves y reptiles raros,"Recomendable al atardecer o al amanecer, este sereno viaje a través de los manglares ofrece vistas de caimanes formulario firmas en la duración de las armas el barco. Pero lo mejor de todo es la gran aves y un montón de pájaros tropicales y migratorias en vista de las garzas, garcetas, martín pescadores, y mucho más. puedes ver las de nidificación y cómo interactúan entre sí y muy cerca.Intenta conseguir un barco a su grupo de lo contrario los pequeños barcos podría parecer estaba llena de gente. Existen dos compañías rectoras. Nos quedamos muy contentos con nuestra guía de la compañía de camisa roja. él hizo que la excursión con su conocimiento y habilidades aves local de identificación. Ir al final del día le permitirá disfrutar de excelentes vistas de la puesta del sol sobre el Océano Pacífico, y la oportunidad de tomar un refresco en las playas claras.Está a un corto trayecto en taxi de forma barata Mazunte, o un viaje aventurero camine a lo largo de la carretera principal, o e incluso más aventureros revuelo a lo largo de la playa a través de la roca de la ventana. Taxi es probable más seguras",5.0,Mazunte,Oaxaca,Attractive,0.8936042678542435,0.820945
9813,El lugar más mágico,"Izamal es mágico no solo por la belleza de la ciudad pintada toda de amarillo, sus lugares coloniales, sus callecitas empedradas y su gente lo hacen único.  El atrio del convento de Izamal, es lugar obligatorio de visita. ",5.0,Izamal,Yucatan,Attractive,0.9326057750731708,0.82624
