row_id,Title,Review,Polarity,Town,Region,Type,sentimiento_5,sentiment
69596,Detenido en aquí en octubre de 2016,"Mi esposa y yo oímos sobre este lugar, y ya estábamos en la isla, decidimos comprobarlo. El personal era lo suficientemente amable para dejarnos entrar y ver lo que tenían que ofrecer antes de comprar los billetes. Es un lugar bonito, pero de lo que vi, no podía justificar un gasto de $69 por persona. Eso es demasiado para lo que ofrecen. . . Cuando se tiene en cuenta especialmente los billetes pueden adquirirse seis banderas por $59 por persona. Así que después de vagar alrededor de 10 minutos, que agradeció a la personal y a la izquierda.Estamos volvimos a la Isla en julio (2017), y esta no será una de las atracciones que visitar.",2.0,Isla_Mujeres,QuintanaRoo,Attractive,0.1103466264903545,0.184125
160411,La suerte de unos pocos,"Volvimos hace unos dias de Mexico y entre muchas cosas fuimos a las ruinas mayas de Tulum, es algo increible, maravilloso y hermoso. Nunca me imagine poder estar en un lugar asi en mi vida, tuve la suerte de conocer uno de los mejores paisajes del mundo. Toda la cultura maya nos parecio increible y como cada cosa era hecha por un proposito.",5.0,Tulum,QuintanaRoo,Attractive,0.9491922482848169,0.789055
27667,Perfecta introducción a la bebida nacional.,"Este nuevo lugar en el mercado de Cholula da en el clavo. El personal era amable, servicial y muy servicial. Las habitaciones son generosas y muy cómodas. La zona de desayuno en la planta baja era cómoda y el desayuno continental como se esperaba. Como es de esperar en un nuevo lugar, hubo algunos problemas menores, pero no distrajeron la experiencia positiva en general. Así, por ejemplo, el cabezal de la ducha era demasiado bajo y los ventiladores en la habitación llegaron solo después de que nos mudáramos. La vista desde la terraza de la azotea es increíble: al borde de la puesta de sol y simplemente observe cómo el volcán se desliza en la noche. Luego diríjase a pie al centro de la ciudad o tome un taxi hasta la famosa zona de vida nocturna, a solo unos kilómetros por la",5.0,Cholula,Puebla,Hotel,0.8754527056589723,0.89747
21811,Cascadas perfectas,"Todo mundo te recomienda las cascadas de agua azul por que sin duda son hermosas y una experiencia que no te puedes perder. Sin embargo, las cascadas de Roberto Barrios aunque no tengan el mejor nombre del mundo son sin duda una de las cascadas mas hermosas en Chiapas. Es una secuencia de 5 cascadas en las que en todas de te puedes meter y tomar fotos, el agua azul cristalina y el sonido de las cascadas es algo que no te puedes perder. Por lo mismo que estas cascadas no son tan conocidas no tienen muchos tours y tampoco tantos turistas.No hay venta de comida por lo que recomiendo, que si vas a pasar ahí el día llevar comida suficiente. Está de lo mejor este lugar!!Busquen al guía Jacob, es el guía que más te cuida en las cascadas, conoce perfectamente bien ese lugar y sabe por donde sí y por donde no. El mejor guía que nació ahí mismo y que va a saber por donde llevar para que te la pases de lo mejor. Estas cascadas están a 40minutos de la zona arqueológica de palenque, recomiendo ir muy temprano a ver las pirámides y terminando ir a pasar la tarde a las cascadas. Está muy fácil de llegar, un poco curveada la carretera pero nada es imposible. MEGA RECOMENDADO",5.0,Palenque,Chiapas,Attractive,0.9392006522975862,0.745199
73206,¡De acuerdo!,"Fuimos aquí ya que estábamos alojados en el lujoso Akumal al lado. La primera impresión es que la piscina es pequeña, sin embargo, seguimos adelante y reservamos el paquete básico ya que mis hijos (13, 10, 5) en realidad no querían nadar con un delfín más interactuar con uno. La señora que dirigió el grupo fue fantástica y aprendimos mucha información sobre nuestro delfín flexible. Mi hijo menor estaba un poco cauteloso, sin embargo, ella realmente lo ayudó y se aseguró de que estuviera involucrado sin ser agresivo. El único inconveniente es el precio de las fotos, especialmente porque no tomaron una foto familiar con el delfín, así que hubiéramos tenido que comprar 5 por separado a $ 45 cada una, para que nosotros tuviéramos un paquete de $ 350 que no era lejos de lo que pagamos por la experiencia. Sin embargo, nos lo pasamos de maravilla e hicimos algunos recuerdos hermosos.",3.0,Tulum,QuintanaRoo,Attractive,0.2114116661250591,-0.057102
189639,Mar y Ruinas,"Hermoso,el entorno de las construcciones es algo unico. un lugar hermoso para conocer y al mimo tiempo podes disfrutar del mar . ",5.0,Tulum,QuintanaRoo,Attractive,0.965614924672991,0.916327
118719,Exelente,"Todos los platillos tienene una excelente sabor, muy buenas porciones, y la atencion de su personal es maravillosa.",5.0,Dolores_Hidalgo,Guanajuato,Restaurant,0.9734327350743116,0.905683
46551,"Como dice todo el mundo, hay que ir temprano para evitar grandes autobuses de excursión, pero vale la pena.","Fascinante, hermosos jardines y vistas. Playa es muy pequeña y casi inexistente con marea alta. Pájaros si vas temprano. Si tienes un coche, intenta ir en coche por la carretera de la playa hasta el final y a pie de esa manera para evitar la zona de aparcamiento y quioscos. Sí, tienes que pagar, pero es un paseo agradable y con sombra.",5.0,Tulum,QuintanaRoo,Attractive,0.7764405123889446,0.636956
72912,Gente nice ,"Me gusto el recorrido , bien explicado , el guía muy amigable y con gran carisma aprendí de los diferentes tipos de Tequila , las instalaciones bonitas la verdad si lo recomiendo ",4.0,Tequila,Jalisco,Attractive,0.9776601355988532,0.961785
199853,cobre utensilios por todas partes,Las obras saturada de cobre para enriquecer el alma hecha a mano por algunos de los metalsmiths y artesanos más increíbles del país. O más funcional objetos como bien ... pero el envío estas piezas cuesta más de las obras en sí mismas.,4.0,Patzcuaro,Michoacan,Attractive,0.7478742972016335,0.825202
122170,tulum ruinas cerca al mar,me parecieron unas ruinas muy lindas cerca al maravilloso mar turqueza q tienen muy bien conservadas y los mexicanos muy amables con los turistas vale la pena ir a conocer es todo una experiencia me encanta la rivera maya,5.0,Tulum,QuintanaRoo,Attractive,0.979664005804807,0.75731
92839,No puede faltar en una visita a Tulum,"Las ruinas mayas de Tulum no son tan impresionantes como las de Chichen Itza, pero están muy bien preservadas y enclavadas en un paisaje impresionante, sobre acantilados al borde del mar turquesa de la riviera maya. Lamentablemente no tuvimos mucho tiempo para apreciarlas ya que cierran muy temprano. Algo a tener en cuenta si las visitan en coche es que hay estacionamiento gratuito, a nosotros nos engañó un cartel viniendo de Tulum que indicaba un estacionamiento y éste era tarifado, más adelante estaba la entrada para el gratuito, tener cuidado, así como eso nos pasó en varios lugares.  ",4.0,Tulum,QuintanaRoo,Attractive,0.5412895902991295,0.607647
176446,Hermoso hotel con impresionante vista de San Cris,"Tuvimos un viaje familiar increíble, desde antes de llegar estuve en contacto con personal del hotel y nos ayudo muchísimo en recomendarnos lugares y darnos tips.  Estuvimos hospedados 4 noches, nuestra habitación era la última por lo que la vista era simplemente increíble! El desayuno buenísimo, preparado al momento y con un sazón muy especial.  La ubicación otro plus, caminando llegas a muchos lugares muy bonitos para conocer. Sin duda es un hotel para vivirlo en familia! ya estamos planeando otra escapada.",5.0,San_Cristobal_de_las_Casas,Chiapas,Hotel,0.9763180252630264,1.0
124835,"Gran vista, interior bonito, comida mediocre y precios altos","Llegamos aquí después de un largo día de viaje y no nos decepcionó. Pedí el pescado del día y mis partes pidió la carne. Nos sentamos en el restaurante con techo de paja con una vista excelente y una banda estaba tocando. El servicio era...estupendo, y la comida estaba bien, y fue un buen juego para comenzar a familiarizarse con la ciudad. Después de estar 4 días y comer en múltiples restaurantes, yo diría que la comida era promedio y por el precio, esperaba más.Más",3.0,Sayulita,Nayarit,Restaurant,0.9560632747597992,0.722658
483,increíble,"Si en México su bien vale la pena tomar el tiempo_espera de ver una de las siete maravillas del mundo. Tiene una buena relación calidad-precio, ya que es un viaje de día completo incluye una parada para nadar en una piscina subterránea increíble, donde celebraron el Red Bull buceo de base campeonato. Tome un sombrero para la sombra, ya que es extremadamente caliente y también puedes comprar tus recuerdos allí ya que tienen los titulares de puestos que venden cada tema posible a una fracción del precio en las tiendas y ciudades. Los guías son muy eficientes y está bien organizada. En general increíble.",5.0,Tulum,QuintanaRoo,Attractive,0.9724497869610786,0.796035
136275,"Sol, mar y salada pelo",Creo que satisface los eco de chic. Este hotel boutique elegante esconderse en las orillas puras de Tulum es un paraíso bohemio por la moda y tipos entusiasta. Cada habitación ofrece un exclusivo ambiente ya sea por entre los árboles o abajo entre las piscinas de inmersión. Ser Tulum es todo lujo y naturaleza combinado para hacer el paraíso tropical perfecto. querrás quedarte y comer y pescado de ceviche taco es para siempre!,5.0,Tulum,QuintanaRoo,Hotel,0.9587503215298055,0.827194
144077,Falta este paraíso...,"Fuimos a Casa Malca para nuestra boda aniversario el 16 de agosto al 21. El servicio fue excelente, ya que entrar a la zona de recepción son recibidos con la más amable y servicial joven cuyo nombre es Jesús, como esperamos para nuestra habitación nos llevó al restaurante donde Simone, el chef más increíble y creativo, tuvimos la comida más deliciosa, justo en la playa, todos los camareros estaban en el punto, es muy agradable. El desayuno está incluido, es delicioso, natural CHURRASQUERIA: buena. Nos paramos en la habitación #1, que era una suite frente al mar con impresionantes vistas del océano. La decoración de la habitación y la propiedad son preciosas, muy único. La habitación era muy cómoda, un buen aire acondicionado. La ubicación es perfecta, el 6 de playa es",5.0,Tulum,QuintanaRoo,Hotel,0.9605421663727612,0.819776
133153,Como hecho en casa de Italia,"Excelente calidad. Se fijan en TODOS los detalles. Desde la presentación de los platillos. Todo está hecho ahi mismo. Muchísima calidad. La salsa de tomate es hecha para cada día. Recomiendo las empanadas de la Nonna, lasaña, polenta, pero todo está buenísimo. Postres excelentes y...Más",5.0,San_Cristobal_de_las_Casas,Chiapas,Restaurant,0.969889160245657,0.95983
71513,Mi lugar favorito para cenar en cholula,"La relacion calidad precio es excelente, ademas de que el lugar es fantastico: clasico. frances, y muy organizado.
No olvides pedir unos rollos de jamon serrrano o camaron!
DELICIOSOS!",5.0,Cholula,Puebla,Restaurant,0.9484436917118728,0.965336
41785,"Lugar increíble! Quiero el propietario a adoptar, así que puede vivir allí!","Llegué veinte minutos antes de la hora (10:00) porque la apertura RSVP obligatoria sugirió que funcionan con un horario demasiado rígido. Cuando llegué allí, yo era la única, y solicita que esperar hasta un gran grupo organizado apareció para comenzar la excursión alrededor de la mansión.Después de esperar casi 45 minutos, con el gran grupo siguen ausentes, el propietario de la casa personalmente me saludó y se disculpó generosamente por el retraso. Sigue siendo el único, tuve mi propio guía y el lugar en el que yo más o menos, y en retrospectiva era muy agradecidos y no habría que cualquier otra manera!La espera, aunque no previstas o desear, valió la pena, ya que la casa fue asombroso! El guía de la excursión fue muy profesional, amable, eficiente y bien informado. Dijo que la típica excursión dura aproximadamente una hora. Creo que acabamos quedándonos 1,5 - 2 horas porque me mantuvieron tomando fotos y pedir un montón de preguntas.Esta estética puede no gustar a todo el mundo (sin duda no para mí, me sentí que había muerto e ido al cielo, y el cielo estaba esta increíble casa de Valladolid con arte y artesanía increíbles! ), sin embargo, sigo pensando que nadie sería curioso y muy bien acogidos por la escala y el diseño de la casa. Los cinco barrios, cada huésped diferente tienen su propio régimen cuidadosamente decorada de diseño, la zona de la piscina es para morirse, y una mesa de comedor con las sillas pintadas a medida es magnífico.Mi favorito piezas son el Frida, Diego, Catrina banco de madera en el vestíbulo, y las representaban cráneos madera intrincadamente pintadas en la estantería de la sala de estar.El patio del centro es tan cálido y acogedor, me imagino que esto podría ser una excelente cama y desayuno o un lugar precioso para una boda.El propietario, John, era acogedor y atento. Me encantó el hecho de que todas las ganancias de las excursiones va a beneficiar a la comunidad. En el futuro, sería maravilloso si ha publicado un catálogo de todas las piezas increíbles en su colección, sin duda alguna compra. Todos ellos están intrincado, se indicará, y de trabajo prácticos piezas, digno de ser visto por todos.",5.0,Valladolid,Yucatan,Attractive,0.0583352744579315,-0.354954
30605,CARENTE DE NECESIDADES BASICAS,"Los blancos están muy desgastados y ásperos, las camas y almohadas están en pésimas condiciones, no son cómodas. No tienen la capacidad de abastecer de agua caliente a todos los huéspedes y, menos si están llenos. Falta variedad de platillos y mesas para el desayuno.",2.0,Orizaba,Veracruz,Hotel,-0.9785781665705144,-1.0
13002,El paraíso sí existe y es la laguna de Bacalar,"La laguna Bacalar hace que la visita a Chetumal valga mucho la pena. Sin gran oleaje y con lugares para caminar (en algunos lugares mide un metro o menos), está rodeada de selva y algunos humedales. !Es realmente bellísima!",5.0,Bacalar,QuintanaRoo,Attractive,0.97568096825853,0.576579
72769,Jardín agradable,"Estuvimos en un jardín maravilloso ñ, fue el mejor desayuno que e tenido en años, gracias a Roger que nos brindó un excelente servicios",5.0,Valladolid,Yucatan,Restaurant,0.9772549371700734,0.932486
88172,Paraíso tranquilo refugio en,"Era tan hermoso y relajante. Me encantó la ubicación porque está rodeado por la selva y los sonidos de la naturaleza. No una picadura de un mosquito. . . La piscina es preciosa, con una cascada, muy refrescante. Me gustó el paisaje de jardín y apreciamos la arquitectura fresca y colores preciosos. Me gustó tener que subir escaleras de aire abierto a nuestra habitación. Creo que perdí peso en vacaciones. . . 15 minutos de la playa. s. s, a 5 minutos de la ciudad. . Es el paraíso.",5.0,Tulum,QuintanaRoo,Hotel,0.9721823944710196,0.737436
36962,Lugar de descanso,"El parque es un lugar muy relajado para estar observando todo lo que pasa y muy limpio, nos tocó que había una carrera alrededor del parque y lo bueno es que todo queda cerca de ahí para andar caminando ",5.0,Valladolid,Yucatan,Attractive,0.9699284904636444,0.870079
161249,Desayuno,"Muy buenos platillos y excelente servicio
Buena y rápida atención, de los parte del personal. Muy recomendado",5.0,Tequisquiapan,Queretaro,Restaurant,0.9749928235542028,0.93683
64935,"Natación, paddle, esnórquel, relajarse y comer comida increíble","Me quedé muy impresionado con nuestro anfitrión, el Director General Sixto Navarro que se aseguró de que cada paso de mi viaje fue increíble y relajante. Comencé con un paseo por la playa y nadar bien hacia la bahía, lo que es poco profunda en marea alta. La piscina era preciosa, tranquila. Mi habitación era increíble, con enormes ventanas que me permitió disfrutar de las preciosas montañas sobre el paisaje del océano. La cómoda cama y gran porche.La comida era increíble, tengo que he ganado 5 libras! También fuimos buceo en el mar de Cortez donde llegamos a pasar el rato con delfines para un poco, y nadar entre magnífica variedad de pescado. Más tarde, entre comidas, paddle embarcamos en la bahía (gratis), pero también se puede hacer kayak en un claro fondo kayak así que puedes",5.0,Loreto,Baja_CaliforniaSur,Hotel,0.9706631721928716,0.748389
83811,Impresionante,"Esta ciudad sigue siendo majestuosa luego de cientos de años, solo si estas ahí puedes tratar de llevar tu imaginación a su época de esplendor.  Visita obligada.",5.0,Teotihuacan,Estado_de_Mexico,Attractive,0.9370308676734568,0.801269
108315,Cena de postres,"El servicio excelente, buena comida y ambiente, es un buen lugar para compartir con las personas que quieres...",5.0,Metepec,Estado_de_Mexico,Restaurant,0.9763899391982704,0.917243
159970,"Gran restaurante, mejor vista","Comida excelente, gran curry tailandés platos, una excelente selección de vinos de América Latina incluyendo una red mexicana sorprendentemente maravillosamente acabado. Pero el patio exterior con vistas a un hermoso tramo de playa de Tulum fue el mejor!",5.0,Tulum,QuintanaRoo,Restaurant,0.97308696154505,0.862994
79107,agradable Malecón,"El Ajijic Malecón es una maravilla desde la mañana temprano hasta tarde. Mi esposa y yo, junto con otros muchos, camine a lo largo del malecón para largos múltiples. Además de la tranquilidad del lago Chapala, las aves acuáticas silvestres y los pescadores locales contribuyen a la magia de la zona.los fines de semana son vivos con las familias, eventos y actividades.Un lugar casi mágico.",4.0,Ajijic,Jalisco,Attractive,0.9647345470730216,0.873594
137072,Increible,"Increible las ruinas y tiene una vista inigualable, una de las mejor playa del mundo.!! una gran excursión.",5.0,Tulum,QuintanaRoo,Attractive,0.9759217447135596,0.854657
64285,Comida mexicana,Excelente lugar ! Nos pareció muy rico y muy buena atención .  La comida mexicana les gusto mucho a los niños.,5.0,Tapalpa,Jalisco,Restaurant,0.9793771721888334,0.9542
64962,Nos costó un poco de tiempo para calentar a este lugar,"Llegamos desde Mérida después de un largo viaje en coche esperando el lux final de nuestro intenso viaje con una estancia en la playa  que no nos gustó el ambiente inicial. Después de conducir por la carretera sur de Tulum por una mezcla de viviendas junto al mar desde un estilo rústico hasta elegante encontramos este lugar en un principio un poco decepcionante. La zona de recepción parecía muy rústico y encontramos la recepcionista inicial muy desagradable. No me gusta tener que pagar la factura del hotel por adelantado. Realmente da fuera del aire no confiaban en sus clientes una de las cosas que nos impactó al principio que era una propiedad de primera clase dólar, pero esto nos sentimos muebles desemparejados con el servicio y el ambiente de la propiedad La comida es servida",3.0,Tulum,QuintanaRoo,Hotel,-0.9739900946151464,-0.9496
128888,Poquito pero entrenido,"Muy bonito, pocas cosas pero es un lugar muy entrenido para la familia, espero que más adelante pongan más cosas.",4.0,Orizaba,Veracruz,Attractive,0.9699103243183343,0.971701
204439,Muy tranquilo y muy ameno para descansar,"Mi estancia fue muy buena y tranquila a pesar de ser en temporada se semana santa, al retirarme olvide una chamarra con un valor sentimental invaluable y a pesar de haber pasado tiempo el hotel la guardo y me la hizo llegar a la CDMX sin problemas y de la manera mas atenta.  Felicito a todo el equipo por el excelente servicio y gran apoyo.",5.0,Valladolid,Yucatan,Hotel,0.962147862650454,0.897174
70633,Aceptable y no económico,"Alimentos muy comunes, a precios no muy accesibles, ebuena vista y muy buen servicio, nada extraordinario ni tipico",3.0,Taxco,Guerrero,Restaurant,0.747789466753602,0.411015
202704,Tulum,"Tulum es de esos lugares como de cuento de hadas, pasas por un pequeño pasadizo en la muralla y descubres un sitio fascinante lleno de misterio y tranquilidad, en el que la historia y la belleza del paisaje se unen para hacer de Tulum un lugar único. No conozco nada parecido es, simplemente maravilloso",5.0,Tulum,QuintanaRoo,Attractive,0.9552421774715184,0.818389
26203,Despedida de soltera,"La mejor noche de mi vida, amé el lugar y el servicio sobre todo mi amigo Eduardo, nos atendió de lujo!!! 
gracias!!!!",5.0,Tulum,QuintanaRoo,Restaurant,0.9764619781635702,0.280519
6639,Muy bien,"Veo gente quejándose, si no quieren está experiencia que paguen más no sean piojos, por que hay hoteles de.lujo en Valladolid. Este es un hotel muy económico, limpio, colonial, pequeño y por lo que pagas está muy bien, de verdad esta muy bien ",5.0,Valladolid,Yucatan,Hotel,0.9436527583748102,0.126027
108526,"Un buen restaurante en el centro de la ciudad de Valladid, buen servicio y menú en inglés! dueños Ayan","Uno de los mejores restaurantes de Valladolid, justo en la plaza de la ciudad. Hay turistas en el lugar, así como algunos lugareños. Prueba rellenas chili Pepper y chisporroteo quesedillas. Los precios son naturalmente un poco inflados. Me gustaron los techos altos y decirations de...pared. dueños AyanMás",4.0,Valladolid,Yucatan,Restaurant,0.9447654152754694,0.976106
21224,Muy malo,"Sucio y viejo Las camas están incomodas, el baño es una vergüenza y huele mal, hasta el agua que sale de la llave huele pésimo  Lo único bueno es que tiene una vista muy bonita No me volvería a quedar ahí ni aunque me lo regalaran.",1.0,Bacalar,QuintanaRoo,Hotel,-0.971259135287255,-0.766228
54546,Una atracción que enaltece una ciudad en plena evolución hacia el futuro!!!,"Un servicio de primera, con un entorno muy cuidado y seguro aun precio muy justo, una atracción digna de ser recomendada y presumida por los habitantes de la ciudad, comparable y con ganancia a favor con atracciones en los EUU....",5.0,Orizaba,Veracruz,Attractive,0.9493720876052976,0.36758
73587,Las pizzas son deliciosas ,"El restaurante tiene una buena carta de platos italianos, lo que más nos gustó fueron las pizzas. El ambiente es bueno.",5.0,Bacalar,QuintanaRoo,Restaurant,0.97733121085912,0.824338
189995,Lindo cafe y rico!,Fuimos de visita a Tepotzotlan en la tarde y buscábamos un cafe exactamente a Esencias Cafe. Un lugar pequeño y encantador con un menú variado entre tes y cafés fríos y calientes. Pedimos unas tapas que estuvieron muy buenas para acompañar nuestras bebidas.  Recomendado!,5.0,Tepotzotlan,Estado_de_Mexico,Restaurant,0.9561147221829742,0.793129
204244,Súper el servicio,"Excelente trato, instalaciones acogedoras, todo limpio, la comida súper rica, estacionamiento seguro y los servicios en general súper recomendables, precios accesibles y facilidad para hacer reservacio",5.0,Valle_de_Bravo,Estado_de_Mexico,Hotel,0.9650651433039455,0.769475
56382,Excelente para desayunar ,"Una excelente opción para desayunar. Los desayunos de excelente sabor, el chocolate buenísimo, al igual que las corundas, uchepos y las enfrijoladas. Lo mejor es su ubicación, frente a la plaza central. La atención muy buena también. Sin duda regreso pronto.",5.0,Patzcuaro,Michoacan,Restaurant,0.977185360272415,1.0
18121,saber antes de ir (Pros y Contras),"En resumen, es bonito y pintoresco y pequeño hotel bien mantenido. Es sin embargo muy escaso en cuanto a variedad. Tienen un restaurante, un minúsculo bar al lado del vestíbulo, un par de piscinas justo al lado de la otra y una playa privada. Con excepción de su habitación y el arte/joyería, eso es realmente.  Pros: No había niños :) agradables jardines limpios (pequeña, muy pequeña) Las habitaciones son normales (un poco anticuado y sofás eran muy viejas pero bien) taxi gratuito (un poco) de agua ubicación (si quieres estar lejos de todo.) acceso y limpieza de playa cortés personal Gran desayuno menú de la cena era 7 de 10 (los precios son un poco altos para calidad) Acceso gratuito a Internet inalámbrico (irregular) Las camas y la ropa de cama eran agradables  En contra: - muy",3.0,Isla_Mujeres,QuintanaRoo,Hotel,0.5464197024703026,0.641313
47587,Una sorpresa increíble,"En un recorrido por la Península de Yucatán encontramos este hotel y ha sido una gran experiencia.  El servicio fue genial, todo mundo nos sonreía todo el tiempo y siempre se aproximaron con una sugerencia para que pudieramos conocer más de esta región. La comida en el Restaurante muy rica, con buena presentación y porciones adecuadas.  El precio razonable, lo cierto es que no esperabamos encontrar un lugar con esta calidad, sin duda el mejor hotel en Valladolid, se los recomiendo.",5.0,Valladolid,Yucatan,Hotel,0.975497437408194,0.90748
17587,ruinas de Tulum,"hace calor, sin duda llevar un sombrero y llevar agua. Las ruinas son pequeñas pero nuestro guía nos hizo la experiencia muy interesante. No puedes subir las escaleras. Asegúrate de que te lleve su traje de baño y una toalla. Ir a la playa, el agua es parte de la turquesa más increíble que verá jamás.",4.0,Tulum,QuintanaRoo,Attractive,0.9459543251432478,0.978528
31686,Comida familiar ,"Excelente lugar para disfrutar en familia
La comida super genial 
La música y el ambiente es sumamente
Perfecto. Y la atención de Francisco y recomendacion de postres   fue increíble..",5.0,Metepec,Estado_de_Mexico,Restaurant,0.9802544405683876,0.840512
12794,Casi 5 estrellas ,"La comida y bebidas con buen sabor el precio medio a medio alto, la parrillada para 4 personas lo vale, solo q el servicio del mesero lenta y si hay otro desocupado se molestan porq no es su mesa, en general un buen lugar para...Más",4.0,Tlaquepaque,Jalisco,Restaurant,0.2389616519212722,0.168267
132612,"Muy buen servicio, Luis y","Muy buen servicio, Luis y David nos atendieron de maravilla. Los alimentos deliciosos, muchas gracias.",5.0,Tulum,QuintanaRoo,Restaurant,0.9781296353321522,0.743216
