row_id,Title,Review,Polarity,Town,Region,Type,sentimiento_5,sentiment
185954,Buena comida,Vinimos aquí para el desayuno y los huevos benedictinos. Fue increíble. No dar a todos 5 estrellas porque el servicio estaba bien. Un poco lento y no demasiado amable. La comida compensaba aunque,4.0,Isla_Mujeres,QuintanaRoo,Restaurant,-0.8663695091381669,0.730801
64543,"Limpio, cómodo, cerca de ADO","Nos alojamos aquí por unos pocos días mientras estuvimos en Palenque. Habitación estaba muy limpia, la cama un poco pequeña pero cómoda para dos personas y un buen servicio del personal. Me alojaría aquí de nuevo. Muy cerca de la terminal del ADO. La zona alrededor del hotel es un agradable ambiente tropical, con grandes árboles y una calle tranquila y agradable. No mucho en Palenque y esta zona es mejor que en el centro de la ciudad. Los restaurantes están muy cerca también.",3.0,Palenque,Chiapas,Hotel,0.9617167683318256,0.841041
183634,Linda iglesia colonial,"Esta hermosa iglesia está ubicada en plena plaza de armas de Valladolid. Es una iglesia colonial hermosa y que destaca dentro de los edificios de la plaza. Es más impresionante su exterior que su interior, pero vale la pena verla. Recomendable.",4.0,Valladolid,Yucatan,Attractive,0.9652220050338656,0.763162
41469,Bravooo,"El mejor hotel indiscutiblemente en tequisquiapan, acogedor y elegante. Este lhotel cuenta con todas las necesidades al menos básicas para una familia. Mi esposa y mi hijo se la pasaron en la alberca todo el día el segundo día, el primer día recorrimos diferentes lugares, el tranvía, cavas de quesos, freixenet, el famosísimo restaurante Laysu, etc. Este hotel vale la pena garantizado al 100",5.0,Tequisquiapan,Queretaro,Hotel,0.9585533910430968,0.919117
173578,El tipo de playa que soñar,"Como dice el título, este es probablemente uno de las playas más hermosas que he visto en su vida. Los carteles de cerveza Corona no le hacen justicia. El agua color turquesa claro y azul claro se siente como un baño tibio, la arena como polvo blanco que está guay bajo sus pies en la discoteca más sol. Justo al sur de las ruinas mayas, a la biosfera Sian Kaan reserva natural, las playas sólo se tornan más hermoso. Esta es una playa no puede perderse, si estás visitando la península de Yucatán.",5.0,Tulum,QuintanaRoo,Attractive,0.8197697252035141,0.856112
90844,"Bueno, pero sobrevalorado","El hospedaje es limpio y ameno, pero de estilo sencillo. Las tarifas varían según temporada. Hay otros hospedajes cuya relación precio calidad puede ser igual o mejor con habitaciones más amplias y en algunos casos con ubicación más céntrica.",3.0,San_Cristobal_de_las_Casas,Chiapas,Hotel,0.4863640898838639,0.641709
87603,Excelente comida.,"Un lugar que definitivamente vale la pena en Izamal, comida yucateca tradicional con excelentes platillos y servicio.

Venado, cochinita pibil, panuchos, helados artesanales. La calidad fue muy buena, un lugar sorprendente.

Lo único que sugeriría mejorar es el café de olla.",5.0,Izamal,Yucatan,Restaurant,0.9762550084851682,0.793441
184485,Precioso jardín para una comida especial,"Amigos conocimos para la cena y compartimos bocadillos y cada uno un plato diferente. pedimos Todos fueron tan sabrosa y única. Fue una noche especial con amigos, buena comida y excelente servicio. Gracias por una comida maravillosa.",5.0,Isla_Mujeres,QuintanaRoo,Restaurant,0.9792956593446434,0.777929
124119,Bonito lugar.,"Sin duda una de las visitas obligadas si viajas a la Ribiera maya, las vistas del Mar Caribe desde las ruinas son verdaderamente impresionantes, una visita que se puede realizar por libre contratando un coche desde la mayoría de hoteles, impresiona la gran cantidad de iguanas que hay por toda las ruinas.",4.0,Tulum,QuintanaRoo,Attractive,0.958967624232173,1.0
123726,Fascinante viaje de esnórquel con personal amable,Realmente disfrutamos de Dos Ojos. Elegimos la excursión de buceo que implicaban buceo tres cenotes. Liz fue nuestro guía y ella era muy servicial y amable. Era tan increíble piscina en medio de estalactitas y estalagmitas de una cueva a otra. La cueva de murciélagos era increíble! Este cenote fue recomendado por una guía en un viaje de buceo en Akemal y estoy realmente contento de que seguimos su consejo.,5.0,Tulum,QuintanaRoo,Attractive,0.965714221354574,0.702563
159744,Bonito pero chinches ,"El hotel es acogedor, las habitaciones muy bonitas. La ubicación es exclusiva pero....nos toco una habitación conbaño diminuto. 1era noche picados por chinches. La encargada de limpieza cambia sabanas. 3era noche chinches en la almohada y nos cambian de habitación donde había un baño amplio y moderno. Una mala experiencia para tan bonito hotel.",2.0,San_Cristobal_de_las_Casas,Chiapas,Hotel,-0.8857469316571951,-0.793201
72654,"Hotel La Joya ""la joya"" en vidas inglés a su nombre.","Tranquilo, con excelentes vistas disponibles desde los balcones de 14 habitaciones, atendida por un atento, eficiente y el personal habla ingles este pequeño hotel está bien merece una estancia prolongada. Después de 11 días en marzo de 2017 nos dio pena irnos. El desayuno continental gratuito era fresco y satisfactorio como las comidas disponibles en el pequeño restaurante para el almuerzo y la cena. Lo mejor de todo las comidas eran todos trajeron al balcón precioso delante de tu habitación! Realmente disfrutamos de la piscina y caminar por sus pasos para nadar y bucear en una zona de mar muy bonito con un par de cuevas lo suficientemente grande para sentarse. El hotel ofrece kayaks y máscaras y snorkles gratuito a sus huéspedes. Eres un taxi de 15 minutos en coche desde",5.0,Isla_Mujeres,QuintanaRoo,Hotel,0.9707204680889844,-0.159285
54372,UN MUSEO DIFERENTE,"esta muy padre el concepto de los duendes, elfos etc. los sábados a las 8 hay un recorrido nocturno al árbol de las almas, muy buena experiencia",5.0,Huasca_de_Ocampo,Hidalgo,Attractive,0.972565407399088,1.0
165733,Moya ,"Excelente todo,me encanta el ambiente,la atención,la comida riquísima,los masajes una delicia,las habitaciones muy cómodas todo con excelencia y Tepoztlan un lugar místico lleno de energía y casa Isabela un lugar hermoso ",5.0,Tepoztlan,Morelos,Hotel,0.9786173303145916,0.831061
93517,Interesante pero pequeño,"Las ruinas son interesantes para los amantes de la historia, no se puede ingresar a las ruinas, pero se ven bien dede afuera, no lo encontramos gran cosa, era mas bonita la playa que estaba al lado",3.0,Tulum,QuintanaRoo,Attractive,0.89928192878142,0.845121
153285,Muy buen hotel - great experience!!,"El hotel esta ubicado en una parte muy tranquila y bonita del pueblo y se puede caminar al restaurantes y al centro del pueblo muy facilmente. Las habitaciones estan de buen tamano y muy limpias. El staff es muy amable, son muy serviciales y el restaurante esta muy rico en especial los desayunos. El precio por la habitacion tambien es algo que esta muy bien, todo Chiapas es muy barato en general. Yo si recomiendo este hotel para quien busque un hotel limpio y bueno a buen precio. Lo unico es que no tiene alberca pero pues si quieren alberca tendran que pagar mas en otros hoteles. De ahi en mas muy buena experiencia en Palenque!!",4.0,Palenque,Chiapas,Hotel,0.9370799069292844,0.774077
35908,El mejor lugar para comer en Isla Mujeres,"Indiscutiblemente el mejor. Tuve una hamburguesa aquí que era increíble. para echarle avacado, unas lonchas de jamón picado, lechuga, tomate y queso. Sólo abre para el desayuno y el almuerzo. En realidad hay otras 3 loncherias situado al lado. Todos eran muy buenos. los precios...más bajos que los restaurantes de Hildalgo.Más",5.0,Isla_Mujeres,QuintanaRoo,Restaurant,0.869806008413434,0.768613
45966,Estupendo lugar estupendo personal,"Vine aquí para cuatro días y lo pasamos muy bien. la comida y los espectáculos fueron muy buenos, pero lo mejor es la gente que trabaja aquí, todos fueron respetuoso y lo más importante. Incluso los camareros. Es adecuado tanto para parejas como para familias.",5.0,Tulum,QuintanaRoo,Hotel,0.9743352802470326,0.935381
194155,Qué ver,Esta es una visita obligada para todos los viajeros. Se puede decir que usted ha estado en el punto más oriental de México. La cerveza en el restaurante no está mal.,5.0,Isla_Mujeres,QuintanaRoo,Attractive,0.9560929785948248,0.802933
13286,Mango Cafe,"Hicimos Mango Cafe cambiado todo el plato de tortilla de harina de maíz y fue espléndido para poder tomar gluten comida gratis. La espera fue un tiempo (quizás porque había 10 de nosotros) y el personal de cocina intentamos servir en consecuencia, pero valió la...pena la espera. volveremos.Más",5.0,Isla_Mujeres,QuintanaRoo,Restaurant,0.8736829590052366,0.74158
92357,Una visita obligada en Tulum!,"Este lugar es increíble, la belleza de las ruinas mayas con un impresionante marco de aguas de color turquesa y árboles verdes palmeras!Si vas a visitar Tulum, usted debe visitar estas ruinas!",5.0,Tulum,QuintanaRoo,Attractive,0.9418006869964302,0.82985
114324,ñam ñam!,"Hicimos un viaje de un día hasta Sayulita, que comenzó con el almuerzo en Don Pedros. Nos encantó estar con una vista de la playa en el patio al aire libre, que era la sombra suficiente para mantenerte fresco. Teníamos un grupo de 7 que...pedimos cosas diferentes y el veredicto para todo estaba bien. El éxito era las plato shrinp aperitivo de las manos.Más",5.0,Sayulita,Nayarit,Restaurant,0.9512267073150724,0.819262
31870,Cena,"Sin duda uno de los mejores restaurantes que he conocido su decoración, ambiente y servicio es el mejor. Nos dejamos guiar del mesero, acertó en todo. Nos gusto todo de principio a fin, el pan artesanal de este lugar es un bocado de nube, el...Más",5.0,Tulum,QuintanaRoo,Restaurant,0.9772551176138222,0.830898
166510,No limpia para nadar,"Si tienes niños pequeños, dirí­jase a la Playa los muertos, a un corto paseo al sur de Sayulita para un limpiador, más seguro nadar!",1.0,Sayulita,Nayarit,Attractive,0.2754440791904926,0.232683
12253,Agradable ,"El lugar es muy agradable, la comida es buena y la atención también, la terraza tiene una vista linda, los precios son justos.",4.0,Tequisquiapan,Queretaro,Restaurant,0.97834634128958,1.0
31739,Bar de playa estupendo aquí­ y increí­ble lugar para ver la puesta de sol!!,Gran lugar para nadar y ver la puesta del sol! Buen bar de playa para sentarse en los columpios y beber! El agua aquí­ es de color increí­ble y la playa es lo suficientemente profunda para soportar unos 100 metros!,5.0,Isla_Mujeres,QuintanaRoo,Attractive,0.9713213685899972,0.896503
98321,¡El mejor restaurante de Mazunte!,"El Armadillo tiene la mejor comida, el mejor ambiente y el mejor servicio de Mazunte. Sin duda.
El personal es amable y extremadamente atento a las necesidades de los clientes. El propietario del lugar, además de ser súper simpático, se asegura de que todos reciban...un servicio inigualable.
Y la comida... ¡es DELICIOSA! Imposible describirla. Tiene todo: buen sazón, buena presentación, combinación de sabores impecable. Además las porciones son bastante generosas. ¡Nunca nos quedamos con hambre!
Otro plus: son geniales con los niños. Nosotros siempre vamos con nuestros hijos (4 y 1 año) y el personal se asegura de que tengamos todo lo que necesitamos para que nuestra estancia sea lo más placentera posible (sillita de bebé, hojas para colorear, platillos especiales...)Más",5.0,Mazunte,Oaxaca,Restaurant,0.9681231994181873,0.942002
188043,Un buen lugar para descansar.,"El hotel está muy limpio, las habitaciones cuentan con todo lo necesario sin lujos, tiene estacionamiento, esta fácil de llegar desde la carretera.  Tiene un pequeño bar y karaoke que cierra a la 1:30 de la mañana. Toallas limpias, camas limpias, internet inalámbrico, es la primera vez que nos hospedamos en Palenque y sin duda será nuestra siguiente selección.",4.0,Palenque,Chiapas,Hotel,0.9511368982493876,0.874431
32247,Pésima comida,"Estábamos en 12 personas, ninguno salió satisfecho con su comida. Sin sazón, horrible. Pedí minestrone, eran vegetales cocidos en agua. Nada más, la pasta pesto con la albahaca pasada, apenas procesada sin sabor alguno. La pasta overcooked. Deje todo el plato pues el sabor estaba...insoportable.Más",1.0,Patzcuaro,Michoacan,Restaurant,-0.667999878525734,-0.450256
171259,Precioso y relajante,"Durante una estancia de 2 noches disfrutamos todos los beneficios de este hotel : gran jardín con piscina y una hermosa naturaleza. Las vistas eran impresionantes. El desayuno en el jardín. La cocina ofrece suficientes posibilidades, así que no tuvimos que ir. SPA fue organizado por profesionales en una habitación zen. El servicio fue excelente y muy acogedor. No podemos esperar a volver!",5.0,Tepoztlan,Morelos,Hotel,0.974122567102313,0.722019
88698,La vista de la ciudad de Taxco y su historia,"Un poco difícil su ubicación pero para el centro es exelente, el servicio es cálido, y se respira la antigüedad del hotel
y las formas de tratar a tanta gente por años de clase mundial",3.0,Taxco,Guerrero,Restaurant,0.9419188951142132,0.986603
143312,Gran desayuno . Comida y bebidas eran buenas y el personal amable. A un precio razonable,"Buena comida y servicio
Buena relación calidad-precio para su $
Volvería de nuevo el próximo año cuando volvamos a esa zona",5.0,Sayulita,Nayarit,Restaurant,0.9191673519089818,0.897727
28710,visita de pareja,"es un lugar muy cálido  para viajar en pareja en medio de la selva,   solo que no hubo recorrido en día lunes para conocer el proceso del plástico y las actividades que nos ofrecieron no pertenecen al hotel y tenias que salir caminando. todo lo de mas muy bien.",4.0,Palenque,Chiapas,Hotel,0.6205362565815449,0.605084
161744,Lugar maravilloso,Nos encantó la playa paraiso con su playa fresca y personal amable. Nos pareció que era la playa más hermosa de Tulum que experimentamos. La comida en el restaurante era perfecto y fantástico para familias - personal mente a su servicio.Nos merece una visita!,4.0,Tulum,QuintanaRoo,Attractive,0.9761371379718184,0.748167
169172,gran descubrimiento,"Yo estaba buscando ""sólo un tazón de sopa"" en el menú de otro restaurante. no tenían sopa y me sugirió que probar Poc Chuc abajo de la calle lateral y me señaló en su dirección. almorzamos y cenamos allí varias veces durante nuestra estancia en...la Isla Mujeres. Los precios son muy razonables, servicio amable y un gran menú para un pequeño lugar. Tuvimos la oportunidad de hablar con otros comensales que volvimos regularmente, así que la palabra-es-en este hotel!Más",4.0,Isla_Mujeres,QuintanaRoo,Restaurant,0.8052401863969862,0.641356
13479,Fantásticos cócteles!,"ganas de encontrar un bar de la ciudad de Nueva York en la playa! Los camareros hacían los mejores cócteles de ingredientes frescos. Cada bebida fue diseñado a lo que cada uno de mis amigos quería de beber. No hay muchos bares que están abiertos...durante el día y no hay otros directamente en la playa, pasamos mucho tiempo aquí! Recomiendo encarecidamente este bar!Más",5.0,Tulum,QuintanaRoo,Restaurant,0.9565078653395176,0.978102
86100,Buena comida asiática.,"Ubicado en la ""Plaza O"", sitio agradable, buena atención y sabrosos platillos. Tiene vista panorámica. Precios accesibles.",4.0,Orizaba,Veracruz,Restaurant,0.9301199628971516,0.740727
125835,Extraordinario,"No puedes dejar de visitar, te dejan sin palabras, venden muchos recuerdos, solo que segun nos dijeron la Plata que venden allí no es de buena calidad, hay otros sitios para comprar plata... tienen que subir la del Sol ...son más de 250 escalones, asi que estan genial para hacer ejercicios ",5.0,Teotihuacan,Estado_de_Mexico,Attractive,0.8297542743384838,0.658252
109187,Artesanía fina,"Se ubica a unos pasos de la Plaza Vasco de Quiroga. Aquí se encuentran trabajos artesanos finos, desde laqueados perfilados y de filigrana de oro, hasta trabajos de madera, cobre, bordados y telas.Además la construcción y distribución del lugar hace un paseo interesante.",5.0,Patzcuaro,Michoacan,Attractive,0.8971616895869374,0.664094
140335,"otra hermosa estancia en Avalon Reef Club, pero ...","Me alojé en el Avalon Reef Club 12/1/12-12 /6/12. Esta es la tercera vez que me alojo aquí. Reservé la suite villa con antelación y las vistas eran espectaculares - lado Windward de la isla desde el lado del patio y sotavento de la isla desde la puerta principal. Todos los empleados eran muy agradables y serviciales. En vez de viajar solo en esta vez, fui con un par de amigos que nos alojamos en una villa diferente. Mi habitación estaba limpia y la comida en el hotel era excelente - pedimos al servicio de habitaciones, cenamos en el desayuno buffet y pedir aperitivos y bucear en sus hermosas playa ... mejor agua turquesa este lado de Bora Bora. Por supuesto, hay muchos restaurantes fabulosos a poca distancia a pie. El único aspecto negativo sería que los teléfonos de las",4.0,Isla_Mujeres,QuintanaRoo,Hotel,0.9262720542028546,0.975345
163319,Perfecto equilibrio entre,"Rentamos la habitación estándar con desayuno incluido. Desde la recepción, personas como Jesús y Jaime hacen que te sientas cómodo.  La habitación (estándar) me pareció muy pequeña pero si tu intención es recorrer la isla, cumple con el objetivo de ser cómoda.  En el restaurante ""Sabor"", el desayuno (incluido) es buffet con opciones para todos los gustos. Los alimentos son de calidad y todo fresco y con muy buen sabor. La atención y servicio de Héctor es destacable.  El Club de playa (""Privilege Beach Club"") del hotel tiene 3 secciones, una tipo restaurante-bar, otra camastros-palapas (en donde estuvimos) y la más pegada al mar cuenta con camas. Desde mi punto de vista, cuenta con uno de los espacios más bonitos de toda la isla. El mar es tranquilo y claro, la arena es fina como",5.0,Isla_Mujeres,QuintanaRoo,Hotel,0.8892857073806226,0.911023
173930,"pescado cocido, fritas riquísimas","Las patatas, salsa servido con sus bebidas son fabulosas. Hemos tenido un par de otras platos allí pero mi favorita estofado de pescado o marisco. Está justo en el clavo. ambiente divertido",4.0,Loreto,Baja_CaliforniaSur,Restaurant,0.960754124680534,1.0
45072,Hermoso lugar pero el servicio MUY deficiente,"La ubicación del hotel es privilegiada y las vistas de revista. Las instalaciones en general muy bonitas y la limpieza aceptable. La comida del restaurante excelente. Desafortunadamente el servicio es pésimo... sobre todo del restaurante. La actitud y apatía de prácticamente todo el personal es inaceptable. Por supuesto es una falta de supervisión e interés de sus gerentes o directores (los cuales en 4 días nunca aparecieron, siendo que en un par de ocasiones solicité su presencia), y eso que acupamos la poca cantidad de 21 cuartos y ni siquiera así....  Esperemos que el o los dueños contraten nuevo personal antes de que pierdan más clientes ",3.0,Bacalar,QuintanaRoo,Hotel,-0.9713882282376288,-0.798699
177063,Buen lugar para comer una pasta,"La pasta Alfredo, subliminal, el mesero me recomendo agregarle pollo, fue exquisito, el pollo empanizado, curjiente, y suave. Fue una cena excelente. La pasra la acompañe con un buen vino, que me ayuda a de pronto cortar la carga del sabor de pasta, haciendo cada...Más",5.0,Valladolid,Yucatan,Restaurant,0.9618456894531846,0.826793
187781,"Buena comida, horrible servicio...","Nos detuvimos en la última noche para la cena porque el lugar parecía tan bonito e interesante dentro de la calle cuando nos fuimos. A nosotros sentados el camarero vino a la mesa para nuestra orden de bebidas, el Merlot, era muy bueno. Marido y...yo pedimos pizzas, que eran increíbles, pero después de conseguir nuestra comida el camarero nunca volvimos a ver, nunca me preguntó si quería otra copa de vino o si necesitábamos algo, o si la comida estaba bien y había sólo una mesa sentado más así que no estaba muy concurrido. Muy decepcionado porque todo lo demás fue perfecto.Más",3.0,TodosSantos,Baja_CaliforniaSur,Restaurant,-0.5581069886684418,-0.493576
99861,Pretención en su máximo explendor.,"Nada fuera de lo común, así como usted lo lee, el lugar esta ubicado en la calle Independencia, calle donde se encuentran muchos negocios, entre éstos; varios restaurantes y galerías de arte, la más famosa es la de Sergio Bustamante.

Casa Luna esta muy bien...Más",1.0,Tlaquepaque,Jalisco,Restaurant,0.8345691622234881,-0.960845
184886,La mejor playa chill out en el planeta!,"La Zebra es un paraíso! La comida es alucinante y sabrosas bebidas. La playa es perfecta y no tiene rocas o escombros que me podía sentir como me acabaron en el surf. WiFi gratuito. Santiago es un camarero genial y todo el lugar muy divertido. Hernán es un conserje increíble. organizaron excursiones geniales para mí y para mis amigos que Chitzen Itzá y el representante cenotes ... no puedo decir lo suficiente sobre Tulum y La Zebra ... de Thai playas, Langkawi, y ningún lugar en el Caribe. La mejor!!! aire acondicionado  dormir con el sonido de las olas y la brisa! Cool personas merodeando por todo el tiempo!  ¡compruébalo!",5.0,Tulum,QuintanaRoo,Hotel,0.968314663739875,0.912279
104655,El mejor lugar para relajarse en la isla,"Porque el agua es poco profunda y tranquila, decidí­ llevar hinchable flotadores que compré en Menards por $2,99 . Flotando en las tranquilas aguas era el mejor y más relajante cosa que hicimos todo el viaje. Nos alojamos dentro de las cuerdas, que no quiere quedarse dormido y flotar lejos. : -) PD ... yo no harí­a esto mientras tomábamos porque serí­a bastante fácil dormirse. Cuando no estés en el agua, hay árboles que puede amarrar una hamaca a leer o dormir en la sombra.",5.0,Isla_Mujeres,QuintanaRoo,Attractive,0.5431626234203577,0.418766
163759,"Sotano de las golondrinas, musica para los oidos","Este lugar lo mas atractivo es ver salir o llegar de las golondrinas y si estas dispuesto a hacer rapel bajar al sotano, aunque es algo caro. Te recomindo llegar aproximadamente a las 5:30 pm y puedas apreciar bien el espectaculo. ",5.0,Xilitla,San_Luis_Potosi,Attractive,0.4997580703347921,0.591694
93641,Buena comida,"He estado yendo a Loreto durante los últimos quince años y siempre ceno en Mita Gourmet. Después de un duro día de pesca, nuestro guía nos deja caer algo del pescado fresco que capturamos y a las 6:30 nos mostramos para un gran banquete. Si...pides por adelantado, hacen una paella asesina. Arroz perfectamente cocinado con langosta, camarón, cangrejo, almejas, pulpo, pescado y otras delicias para las aguas locales.Más",5.0,Loreto,Baja_CaliforniaSur,Restaurant,0.7692127898335457,0.688754
120751,"Buena comida y excelentes presentaciones, no existen paquetes para desayunar.","Excelentes pancakes y sándwiches, las presentaciones están muy bien, siento que los precios son elevados en comparación con lugares que en teoría son más caros y no es así, no hay paquetes de desayunos, por lo que de un platillo y un café americano fin...Más",4.0,Metepec,Estado_de_Mexico,Restaurant,0.2037671655416488,0.219182
173164,Desayuno delicioso con gran atencion,"Fuimos a desayunar mi esposo mi bebe y yo, gran atención por parte de Diego hacia nosotros pero en especial porque el bebe estuviera agusto. Sin duda regresaremos!!",5.0,Atlixco,Puebla,Restaurant,0.9632007833570242,0.755486
57024,Muy recomendado,"El lugar tiene muy buen ambiente, la decoración y la música extraordinaria e indiscutiblemente los cócteles más deliciosos",5.0,Tulum,QuintanaRoo,Restaurant,0.9776879467535764,1.0
6029,Mía reef,Vacaciones d volver a regresar  la verdad todo recomendado chef Cinthia en desayunos siempre atenta la verdad Guadalupe y Diego con su carisma y sus ricas hamburguesas comprobadas  amigos recomendado las bebidas al millón  vengan a conocer mis reef comprobado gracias chef Álvaro Martinez x su estupenda comida,5.0,Isla_Mujeres,QuintanaRoo,Hotel,0.9654281234834344,0.932795
2113,la mejor vista de las ruinas!,"Una de las mejores playas que vimos! Es muy pequeña y constantemente hay mucha gente que baja de las ruinas, pero la vista de las ruinas y el acantilado desde el mar vale la pena bajar y dejar las mochilas en algún lugarcito que quede libre en las piedras! el agua es cálida, limpia y turquesa! Nos encantó!",5.0,Tulum,QuintanaRoo,Attractive,0.9729923580307512,0.859969
174531,Mal servicio de meseros,"Fuimos a desayunar, y de cuando nos sientan pasaron 20 min. para que llevaran pan y para pedir se tardaron 5 min. más.
Después tuvimos que esperar 40 min. más, el restaurante a 3/4 de capacidad.
NO LO RECOMIENDO",1.0,Tequisquiapan,Queretaro,Restaurant,-0.928925500717014,-0.998627
39556,Iván,"Excelente atención! Muy pendientes!! Limpio rápido y extremadamente amables el salmón ufff lo mejor 

Muy buena música y la mejor disposición de toooodo el personal!",5.0,Metepec,Estado_de_Mexico,Restaurant,0.9794116574339568,1.0
26168,"amable propietario, información y excelente desayuno!","Mi esposa y yo nos quedamos en la Posada San Juan durante nuestro viaje a Valladolid. Nuestra estancia allí fue excelente. El propietario, Sara, fue muy servicial, agradable y eficiente. Ella nos dio mapas y un montón de consejos sobre no sólo Valladolid, pero la Península de Yucatán. Estuvimos en una habitación con una cama de tamaño king y fue perfecto. La cama era cómoda, la habitación era espaciosa y el mobiliario era moderno y adecuado para la zona.  Un enorme desayuno está incluido en el precio de la habitación y fue uno de los mejores que hemos tenido. El pan de plátano, huevos revueltos con la salchicha local y cactus, frijoles negros, tortillas, fruta, café y té.  Recomiendo encarecidamente este 4 dormitorio B&B a todo el mundo.  Para más información, consulte nuestro",5.0,Valladolid,Yucatan,Hotel,0.9592929929494858,0.933391
